{
  "schema": "poodle.g16-nucleus-parity-receipt.v1",
  "component": "StatusIndicator",
  "scenario_id": "nucleus.agent.status-indicator",
  "proof_level": "A1",
  "runtime": "gpui-headless",
  "command": "effigy regressions:native",
  "package": "poodle-gpui-preview",
  "package_version": "0.3.0",
  "source_commit": "93266dad973ca6fea2d2e4045bbbf0e21bdf3c0e",
  "lockfile": "packages/gpui/preview/Cargo.lock",
  "lockfile_sha256": "c86c2d11c36c9fcf9326bae438ee6acc3bcedacbaf01ac017a298c1bd3c2a34c",
  "lock_resolution": [
    {
      "name": "gpui",
      "version": "0.2.2",
      "source": "crates.io",
      "checksum": "979b45cfa6ec723b6f42330915a1b3769b930d02b2d505f9697f8ca602bee707"
    },
    {
      "name": "poodle-gpui",
      "version": "0.3.0",
      "source": "workspace"
    },
    {
      "name": "poodle-gpui-preview",
      "version": "0.3.0",
      "source": "workspace"
    },
    {
      "name": "poodle-node",
      "version": "0.3.0",
      "source": "workspace"
    },
    {
      "name": "poodle-render",
      "version": "0.3.0",
      "source": "workspace"
    }
  ],
  "distribution": "workspace",
  "production_path_observation": {
    "observed": true,
    "mount": "HeadlessDriver",
    "render_path": "poodle_render -> poodle_gpui_node_backend::to_gpui",
    "input_dispatch": "gpui-test-platform-dispatch"
  },
  "actions": [
    "mount the production renderer path through HeadlessDriver",
    "replay every shared scenario action through GPUI dispatch"
  ],
  "assertions": [
    "the normalised GPUI snapshot is compared with the committed Svelte DOM snapshot for the same scenario hash"
  ],
  "outcome": "passed",
  "artifact_paths": [
    {
      "path": "test/nucleus-a11y/snapshots/status-indicator.gpui.json",
      "sha256": "e8c429e744ac8b04ab2d7ca1cb37fb316f8bbdbf2c785afd49f3c2aa303df7f6"
    },
    {
      "path": "test/nucleus-a11y/snapshots/status-indicator.svelte.json",
      "sha256": "44531f728122f55205fd28a9cc8a7807495cfcea806feae95051769b130c6aa6"
    }
  ],
  "accessibility": {
    "scenario_path": "test/nucleus-a11y/scenarios/status-indicator.json",
    "scenario_sha256": "1c743609347a037bee1242bd15744acccfe31cf234090acc7712d09a826b8444",
    "gpui_snapshot_path": "test/nucleus-a11y/snapshots/status-indicator.gpui.json",
    "gpui_snapshot_sha256": "e8c429e744ac8b04ab2d7ca1cb37fb316f8bbdbf2c785afd49f3c2aa303df7f6",
    "svelte_snapshot_path": "test/nucleus-a11y/snapshots/status-indicator.svelte.json",
    "svelte_snapshot_sha256": "44531f728122f55205fd28a9cc8a7807495cfcea806feae95051769b130c6aa6",
    "web_only_exclusions": [],
    "diff": []
  }
}