{
  "schema": "poodle.g16-nucleus-parity-receipt.v1",
  "component": "SplitView",
  "scenario_id": "nucleus.shell.split-view",
  "proof_level": "A1",
  "runtime": "gpui-headless",
  "command": "effigy regressions:native",
  "package": "poodle-gpui-preview",
  "package_version": "0.3.0",
  "source_commit": "93266dad973ca6fea2d2e4045bbbf0e21bdf3c0e",
  "lockfile": "packages/gpui/preview/Cargo.lock",
  "lockfile_sha256": "c86c2d11c36c9fcf9326bae438ee6acc3bcedacbaf01ac017a298c1bd3c2a34c",
  "lock_resolution": [
    {
      "name": "gpui",
      "version": "0.2.2",
      "source": "crates.io",
      "checksum": "979b45cfa6ec723b6f42330915a1b3769b930d02b2d505f9697f8ca602bee707"
    },
    {
      "name": "poodle-gpui",
      "version": "0.3.0",
      "source": "workspace"
    },
    {
      "name": "poodle-gpui-preview",
      "version": "0.3.0",
      "source": "workspace"
    },
    {
      "name": "poodle-node",
      "version": "0.3.0",
      "source": "workspace"
    },
    {
      "name": "poodle-render",
      "version": "0.3.0",
      "source": "workspace"
    }
  ],
  "distribution": "workspace",
  "production_path_observation": {
    "observed": true,
    "mount": "HeadlessDriver",
    "render_path": "poodle_render -> poodle_gpui_node_backend::to_gpui",
    "input_dispatch": "gpui-test-platform-dispatch"
  },
  "actions": [
    "mount the production SplitView with its ResizeHandle and collapse toggle",
    "dispatch the shared probe key through GPUI's real input path"
  ],
  "assertions": [
    "separator value, orientation, toggle name, and focus order match Svelte"
  ],
  "outcome": "passed",
  "artifact_paths": [
    {
      "path": "test/nucleus-a11y/snapshots/split-view.gpui.json",
      "sha256": "6a603fd4af55f58f04973c5ee8369106f5cbfda02c492a99f5af86e35c1d9dc9"
    },
    {
      "path": "test/nucleus-a11y/snapshots/split-view.svelte.json",
      "sha256": "d60d20b6a6d671cfa41d0c64646dd6424e86cb783143fa93ca215a94731b97de"
    }
  ],
  "accessibility": {
    "scenario_path": "test/nucleus-a11y/scenarios/split-view.json",
    "scenario_sha256": "be2a123784ee362d1d963e1ce2293eae9ad86826b516b6f295a53882723b11b8",
    "gpui_snapshot_path": "test/nucleus-a11y/snapshots/split-view.gpui.json",
    "gpui_snapshot_sha256": "6a603fd4af55f58f04973c5ee8369106f5cbfda02c492a99f5af86e35c1d9dc9",
    "svelte_snapshot_path": "test/nucleus-a11y/snapshots/split-view.svelte.json",
    "svelte_snapshot_sha256": "d60d20b6a6d671cfa41d0c64646dd6424e86cb783143fa93ca215a94731b97de",
    "web_only_exclusions": [],
    "diff": []
  }
}