{
  "schema": "poodle.g16-nucleus-parity-receipt.v1",
  "component": "RadioGroup",
  "scenario_id": "nucleus.settings.radio-group",
  "proof_level": "A1",
  "runtime": "gpui-headless",
  "command": "effigy regressions:native",
  "package": "poodle-gpui-preview",
  "package_version": "0.3.0",
  "source_commit": "93266dad973ca6fea2d2e4045bbbf0e21bdf3c0e",
  "lockfile": "packages/gpui/preview/Cargo.lock",
  "lockfile_sha256": "c86c2d11c36c9fcf9326bae438ee6acc3bcedacbaf01ac017a298c1bd3c2a34c",
  "lock_resolution": [
    {
      "name": "gpui",
      "version": "0.2.2",
      "source": "crates.io",
      "checksum": "979b45cfa6ec723b6f42330915a1b3769b930d02b2d505f9697f8ca602bee707"
    },
    {
      "name": "poodle-gpui",
      "version": "0.3.0",
      "source": "workspace"
    },
    {
      "name": "poodle-gpui-preview",
      "version": "0.3.0",
      "source": "workspace"
    },
    {
      "name": "poodle-node",
      "version": "0.3.0",
      "source": "workspace"
    },
    {
      "name": "poodle-render",
      "version": "0.3.0",
      "source": "workspace"
    }
  ],
  "distribution": "workspace",
  "production_path_observation": {
    "observed": true,
    "mount": "HeadlessDriver",
    "render_path": "poodle_render -> poodle_gpui_node_backend::to_gpui",
    "input_dispatch": "gpui-test-platform-dispatch"
  },
  "actions": [
    "mount production RadioGroup and replay the shared selection action"
  ],
  "assertions": [
    "the named native radio group has one sequential entry stop"
  ],
  "outcome": "passed",
  "artifact_paths": [
    {
      "path": "test/nucleus-a11y/snapshots/radio-group.gpui.json",
      "sha256": "8a6286a8e47b11088e725f4ca7f2b66c17cf7a2fac37fa194e6df0b5a3618dba"
    },
    {
      "path": "test/nucleus-a11y/snapshots/radio-group.svelte.json",
      "sha256": "9f3ed9d4c535d1e5c9267217fc086cf0ed821dca8e3e9dbe2bb2b2fcd36fa909"
    }
  ],
  "accessibility": {
    "scenario_path": "test/nucleus-a11y/scenarios/radio-group.json",
    "scenario_sha256": "ac6c6ff315767621c20a38d8b2ff79ed1851d7546815944764352220a1f809ae",
    "gpui_snapshot_path": "test/nucleus-a11y/snapshots/radio-group.gpui.json",
    "gpui_snapshot_sha256": "8a6286a8e47b11088e725f4ca7f2b66c17cf7a2fac37fa194e6df0b5a3618dba",
    "svelte_snapshot_path": "test/nucleus-a11y/snapshots/radio-group.svelte.json",
    "svelte_snapshot_sha256": "9f3ed9d4c535d1e5c9267217fc086cf0ed821dca8e3e9dbe2bb2b2fcd36fa909",
    "web_only_exclusions": [],
    "diff": []
  }
}