{
  "schema": "poodle.g16-nucleus-parity-receipt.v1",
  "component": "Button",
  "scenario_id": "nucleus.shell.button",
  "proof_level": "A1",
  "runtime": "gpui-headless",
  "command": "effigy regressions:native",
  "package": "poodle-gpui-preview",
  "package_version": "0.4.0",
  "source_commit": "59a64af50d0f592e7b12d121f24fa8655d8cd67d",
  "lockfile": "packages/gpui/preview/Cargo.lock",
  "lockfile_sha256": "4cf00ae2dd80c976e57dc9db49cc7cd462e5d841bf51c993e0482fc33e9fa277",
  "lock_resolution": [
    {
      "name": "gpui",
      "version": "0.2.2",
      "source": "crates.io",
      "checksum": "979b45cfa6ec723b6f42330915a1b3769b930d02b2d505f9697f8ca602bee707"
    },
    {
      "name": "poodle-gpui",
      "version": "0.4.0",
      "source": "workspace"
    },
    {
      "name": "poodle-gpui-preview",
      "version": "0.4.0",
      "source": "workspace"
    },
    {
      "name": "poodle-node",
      "version": "0.4.0",
      "source": "workspace"
    },
    {
      "name": "poodle-render",
      "version": "0.4.0",
      "source": "workspace"
    }
  ],
  "distribution": "workspace",
  "production_path_observation": {
    "observed": true,
    "mount": "HeadlessDriver",
    "render_path": "poodle_render -> poodle_gpui_node_backend::to_gpui",
    "input_dispatch": "gpui-test-platform-dispatch"
  },
  "actions": [
    "mount production Button and replay the shared pointer action"
  ],
  "assertions": [
    "button role, name, disabled state, and focus match the Svelte projection"
  ],
  "outcome": "passed",
  "artifact_paths": [
    {
      "path": "test/nucleus-a11y/snapshots/button.gpui.json",
      "sha256": "5fbd5b18f76386fa7e8a768ff32421830b468689947a4555a69714a64f9575c3"
    },
    {
      "path": "test/nucleus-a11y/snapshots/button.svelte.json",
      "sha256": "d2df4044f3a93194bf7ac2508c8fac0bed60922cd0c020d6ef78c7d46ef539d6"
    }
  ],
  "accessibility": {
    "scenario_path": "test/nucleus-a11y/scenarios/button.json",
    "scenario_sha256": "523c564e452f77f3cf32e0d5367a3f6545db4a479f18cdbc544a7c53d81742ea",
    "gpui_snapshot_path": "test/nucleus-a11y/snapshots/button.gpui.json",
    "gpui_snapshot_sha256": "5fbd5b18f76386fa7e8a768ff32421830b468689947a4555a69714a64f9575c3",
    "svelte_snapshot_path": "test/nucleus-a11y/snapshots/button.svelte.json",
    "svelte_snapshot_sha256": "d2df4044f3a93194bf7ac2508c8fac0bed60922cd0c020d6ef78c7d46ef539d6",
    "web_only_exclusions": [],
    "diff": []
  }
}