{
  "schema": "poodle.g16-nucleus-parity-receipt.v1",
  "component": "Dialog",
  "scenario_id": "nucleus.navigation.dialog",
  "proof_level": "A1",
  "runtime": "gpui-headless",
  "command": "effigy regressions:native",
  "package": "poodle-gpui-preview",
  "package_version": "0.4.0",
  "source_commit": "59a64af50d0f592e7b12d121f24fa8655d8cd67d",
  "lockfile": "packages/gpui/preview/Cargo.lock",
  "lockfile_sha256": "4cf00ae2dd80c976e57dc9db49cc7cd462e5d841bf51c993e0482fc33e9fa277",
  "lock_resolution": [
    {
      "name": "gpui",
      "version": "0.2.2",
      "source": "crates.io",
      "checksum": "979b45cfa6ec723b6f42330915a1b3769b930d02b2d505f9697f8ca602bee707"
    },
    {
      "name": "poodle-gpui",
      "version": "0.4.0",
      "source": "workspace"
    },
    {
      "name": "poodle-gpui-preview",
      "version": "0.4.0",
      "source": "workspace"
    },
    {
      "name": "poodle-node",
      "version": "0.4.0",
      "source": "workspace"
    },
    {
      "name": "poodle-render",
      "version": "0.4.0",
      "source": "workspace"
    }
  ],
  "distribution": "workspace",
  "production_path_observation": {
    "observed": true,
    "mount": "HeadlessDriver",
    "render_path": "poodle_render -> poodle_gpui_node_backend::to_gpui",
    "input_dispatch": "gpui-test-platform-dispatch"
  },
  "actions": [
    "mount the production Dialog modal with title, description, close affordance, and body"
  ],
  "assertions": [
    "backdrop, dialog, heading, and close-button semantics match the Svelte projection"
  ],
  "outcome": "passed",
  "artifact_paths": [
    {
      "path": "test/nucleus-a11y/snapshots/dialog.gpui.json",
      "sha256": "e6112af77441dac58ef80d24115f2ef8870f2d4111fd673eda477e863fc88faa"
    },
    {
      "path": "test/nucleus-a11y/snapshots/dialog.svelte.json",
      "sha256": "a753f93d65554b18aa0a84830f801f334c66ed1740346965b9fd6de8a108998e"
    }
  ],
  "accessibility": {
    "scenario_path": "test/nucleus-a11y/scenarios/dialog.json",
    "scenario_sha256": "c7fb20a3b98ecd60274d1147a15d1e2f9cd239caf410e597fb882f365de74992",
    "gpui_snapshot_path": "test/nucleus-a11y/snapshots/dialog.gpui.json",
    "gpui_snapshot_sha256": "e6112af77441dac58ef80d24115f2ef8870f2d4111fd673eda477e863fc88faa",
    "svelte_snapshot_path": "test/nucleus-a11y/snapshots/dialog.svelte.json",
    "svelte_snapshot_sha256": "a753f93d65554b18aa0a84830f801f334c66ed1740346965b9fd6de8a108998e",
    "web_only_exclusions": [],
    "diff": []
  }
}