{
  "schema": "poodle.g16-nucleus-parity-receipt.v1",
  "component": "Callout",
  "scenario_id": "nucleus.settings.callout",
  "proof_level": "A1",
  "runtime": "gpui-headless",
  "command": "effigy regressions:native",
  "package": "poodle-gpui-preview",
  "package_version": "0.4.0",
  "source_commit": "403d9b81dcac7e0143fd8889dc188e177ce4cfc7",
  "lockfile": "packages/gpui/preview/Cargo.lock",
  "lockfile_sha256": "4cf00ae2dd80c976e57dc9db49cc7cd462e5d841bf51c993e0482fc33e9fa277",
  "lock_resolution": [
    {
      "name": "gpui",
      "version": "0.2.2",
      "source": "crates.io",
      "checksum": "979b45cfa6ec723b6f42330915a1b3769b930d02b2d505f9697f8ca602bee707"
    },
    {
      "name": "poodle-gpui",
      "version": "0.4.0",
      "source": "workspace"
    },
    {
      "name": "poodle-gpui-preview",
      "version": "0.4.0",
      "source": "workspace"
    },
    {
      "name": "poodle-node",
      "version": "0.4.0",
      "source": "workspace"
    },
    {
      "name": "poodle-render",
      "version": "0.4.0",
      "source": "workspace"
    }
  ],
  "distribution": "workspace",
  "production_path_observation": {
    "observed": true,
    "mount": "HeadlessDriver",
    "render_path": "poodle_render -> poodle_gpui_node_backend::to_gpui",
    "input_dispatch": "gpui-test-platform-dispatch"
  },
  "actions": [
    "mount the production Callout through HeadlessDriver with the shared scenario props",
    "replay the shared dismiss activation through GPUI test-platform dispatch"
  ],
  "assertions": [
    "the live-region role, dismiss button name, and post-activation focus match the Svelte projection"
  ],
  "outcome": "passed",
  "artifact_paths": [
    {
      "path": "test/nucleus-a11y/snapshots/callout.gpui.json",
      "sha256": "c64c63b670b69b01e66fe0e3ec56378a38f3b90054b62961a4707734d00b1652"
    },
    {
      "path": "test/nucleus-a11y/snapshots/callout.svelte.json",
      "sha256": "e5d37cdfe0bb30e1f9caadc0604058ac609a7d64d44fb02fcde57295b2acd072"
    }
  ],
  "accessibility": {
    "scenario_path": "test/nucleus-a11y/scenarios/callout.json",
    "scenario_sha256": "2134597db3542715f0d69e458657f2d8cc7c52f5eeeb58ef76757e8372a03beb",
    "gpui_snapshot_path": "test/nucleus-a11y/snapshots/callout.gpui.json",
    "gpui_snapshot_sha256": "c64c63b670b69b01e66fe0e3ec56378a38f3b90054b62961a4707734d00b1652",
    "svelte_snapshot_path": "test/nucleus-a11y/snapshots/callout.svelte.json",
    "svelte_snapshot_sha256": "e5d37cdfe0bb30e1f9caadc0604058ac609a7d64d44fb02fcde57295b2acd072",
    "web_only_exclusions": [],
    "diff": []
  }
}