{
  "schema": "poodle.g16-nucleus-parity-receipt.v1",
  "component": "AppHeader",
  "scenario_id": "nucleus.shell.app-header",
  "proof_level": "A1",
  "runtime": "gpui-headless",
  "command": "effigy regressions:native",
  "package": "poodle-gpui-preview",
  "package_version": "0.4.0",
  "source_commit": "403d9b81dcac7e0143fd8889dc188e177ce4cfc7",
  "lockfile": "packages/gpui/preview/Cargo.lock",
  "lockfile_sha256": "4cf00ae2dd80c976e57dc9db49cc7cd462e5d841bf51c993e0482fc33e9fa277",
  "lock_resolution": [
    {
      "name": "gpui",
      "version": "0.2.2",
      "source": "crates.io",
      "checksum": "979b45cfa6ec723b6f42330915a1b3769b930d02b2d505f9697f8ca602bee707"
    },
    {
      "name": "poodle-gpui",
      "version": "0.4.0",
      "source": "workspace"
    },
    {
      "name": "poodle-gpui-preview",
      "version": "0.4.0",
      "source": "workspace"
    },
    {
      "name": "poodle-node",
      "version": "0.4.0",
      "source": "workspace"
    },
    {
      "name": "poodle-render",
      "version": "0.4.0",
      "source": "workspace"
    }
  ],
  "distribution": "workspace",
  "production_path_observation": {
    "observed": true,
    "mount": "HeadlessDriver",
    "render_path": "poodle_render -> poodle_gpui_node_backend::to_gpui",
    "input_dispatch": "gpui-test-platform-dispatch"
  },
  "actions": [
    "mount the production AppHeader and dispatch the shared probe key"
  ],
  "assertions": [
    "banner role and accessible name match the Svelte projection"
  ],
  "outcome": "passed",
  "artifact_paths": [
    {
      "path": "test/nucleus-a11y/snapshots/app-header.gpui.json",
      "sha256": "e88b29f76c8a5c1d8e4a55be00583474cdfbedc36ed23a8c7f6ee58d77ffe79d"
    },
    {
      "path": "test/nucleus-a11y/snapshots/app-header.svelte.json",
      "sha256": "10fb3d882a4cedfaff36bb7a40e3abdee6485d4ffa17ac868e864888608000dd"
    }
  ],
  "accessibility": {
    "scenario_path": "test/nucleus-a11y/scenarios/app-header.json",
    "scenario_sha256": "07b2b34f76fa3529cd390b2b118e1ccc78eb3584308dc7716647cb6978ce4033",
    "gpui_snapshot_path": "test/nucleus-a11y/snapshots/app-header.gpui.json",
    "gpui_snapshot_sha256": "e88b29f76c8a5c1d8e4a55be00583474cdfbedc36ed23a8c7f6ee58d77ffe79d",
    "svelte_snapshot_path": "test/nucleus-a11y/snapshots/app-header.svelte.json",
    "svelte_snapshot_sha256": "10fb3d882a4cedfaff36bb7a40e3abdee6485d4ffa17ac868e864888608000dd",
    "web_only_exclusions": [],
    "diff": []
  }
}