{
  "schema": "poodle.g16-nucleus-parity-receipt.v1",
  "component": "AgentChatInput",
  "scenario_id": "nucleus.agent.agent-chat-input",
  "proof_level": "A1",
  "runtime": "gpui-headless",
  "command": "effigy regressions:native",
  "package": "poodle-gpui-preview",
  "package_version": "0.3.0",
  "source_commit": "93266dad973ca6fea2d2e4045bbbf0e21bdf3c0e",
  "lockfile": "packages/gpui/preview/Cargo.lock",
  "lockfile_sha256": "c86c2d11c36c9fcf9326bae438ee6acc3bcedacbaf01ac017a298c1bd3c2a34c",
  "lock_resolution": [
    {
      "name": "gpui",
      "version": "0.2.2",
      "source": "crates.io",
      "checksum": "979b45cfa6ec723b6f42330915a1b3769b930d02b2d505f9697f8ca602bee707"
    },
    {
      "name": "poodle-gpui",
      "version": "0.3.0",
      "source": "workspace"
    },
    {
      "name": "poodle-gpui-preview",
      "version": "0.3.0",
      "source": "workspace"
    },
    {
      "name": "poodle-node",
      "version": "0.3.0",
      "source": "workspace"
    },
    {
      "name": "poodle-render",
      "version": "0.3.0",
      "source": "workspace"
    }
  ],
  "distribution": "workspace",
  "production_path_observation": {
    "observed": true,
    "mount": "HeadlessDriver",
    "render_path": "poodle_render -> poodle_gpui_node_backend::to_gpui",
    "input_dispatch": "gpui-test-platform-dispatch"
  },
  "actions": [
    "mount the production renderer path through HeadlessDriver",
    "replay every shared scenario action through GPUI dispatch"
  ],
  "assertions": [
    "the normalised GPUI snapshot is compared with the committed Svelte DOM snapshot for the same scenario hash"
  ],
  "outcome": "passed",
  "artifact_paths": [
    {
      "path": "test/nucleus-a11y/snapshots/agent-chat-input.gpui.json",
      "sha256": "6afb9167c32aa270d495685981345b8e0f67dc6cc12b3a19448e263e735e6817"
    },
    {
      "path": "test/nucleus-a11y/snapshots/agent-chat-input.svelte.json",
      "sha256": "d0e58ec7958cf6ac321ec3d099adb55abe5f1a7bfc08ea0739b837924e8ea431"
    }
  ],
  "accessibility": {
    "scenario_path": "test/nucleus-a11y/scenarios/agent-chat-input.json",
    "scenario_sha256": "07ad1d66e84454c71094dcad845aaa58afcbfdcc2ef36a6ef67e9a1012f20722",
    "gpui_snapshot_path": "test/nucleus-a11y/snapshots/agent-chat-input.gpui.json",
    "gpui_snapshot_sha256": "6afb9167c32aa270d495685981345b8e0f67dc6cc12b3a19448e263e735e6817",
    "svelte_snapshot_path": "test/nucleus-a11y/snapshots/agent-chat-input.svelte.json",
    "svelte_snapshot_sha256": "d0e58ec7958cf6ac321ec3d099adb55abe5f1a7bfc08ea0739b837924e8ea431",
    "web_only_exclusions": [],
    "diff": []
  }
}