{
  "schema": "poodle.g16-nucleus-parity-receipt.v1",
  "component": "Tabs",
  "scenario_id": "nucleus.navigation.tabs",
  "proof_level": "A1",
  "runtime": "gpui-headless",
  "command": "effigy regressions:native",
  "package": "poodle-gpui-preview",
  "package_version": "0.3.0",
  "source_commit": "93266dad973ca6fea2d2e4045bbbf0e21bdf3c0e",
  "lockfile": "packages/gpui/preview/Cargo.lock",
  "lockfile_sha256": "c86c2d11c36c9fcf9326bae438ee6acc3bcedacbaf01ac017a298c1bd3c2a34c",
  "lock_resolution": [
    {
      "name": "gpui",
      "version": "0.2.2",
      "source": "crates.io",
      "checksum": "979b45cfa6ec723b6f42330915a1b3769b930d02b2d505f9697f8ca602bee707"
    },
    {
      "name": "poodle-gpui",
      "version": "0.3.0",
      "source": "workspace"
    },
    {
      "name": "poodle-gpui-preview",
      "version": "0.3.0",
      "source": "workspace"
    },
    {
      "name": "poodle-node",
      "version": "0.3.0",
      "source": "workspace"
    },
    {
      "name": "poodle-render",
      "version": "0.3.0",
      "source": "workspace"
    }
  ],
  "distribution": "workspace",
  "production_path_observation": {
    "observed": true,
    "mount": "HeadlessDriver",
    "render_path": "poodle_render -> poodle_gpui_node_backend::to_gpui",
    "input_dispatch": "gpui-test-platform-dispatch"
  },
  "actions": [
    "mount the production Tabs node tree with a panel through HeadlessDriver with the shared scenario props",
    "replay the shared scenario actions through GPUI test-platform dispatch (pointer activate a tab, then ArrowRight on it)",
    "read the mounted accessibility projection and the backend focus registry after the host rebuilds",
    "execute gpui sequential focus traversal and attribute every stop to a tracked node"
  ],
  "assertions": [
    "the normalised GPUI snapshot equals the committed Svelte DOM snapshot for the same scenario hash",
    "tablist, tab, and tabpanel roles, names, selected state, controls and labelled-by indices, orientation, and roving focus order match the Svelte ARIA projection",
    "gpui tab traversal visits the tracked focusable nodes in the declared order"
  ],
  "outcome": "passed",
  "artifact_paths": [
    {
      "path": "test/nucleus-a11y/snapshots/tabs.gpui.json",
      "sha256": "5df0ccfbc252a66e611e32aec940b4d48c412ef679d2209cce7d86e27e872913"
    },
    {
      "path": "test/nucleus-a11y/snapshots/tabs.svelte.json",
      "sha256": "19806590f047a7864c4fc7a6af250561ef00c74c8254d16513d58424b257d2b8"
    }
  ],
  "accessibility": {
    "scenario_path": "test/nucleus-a11y/scenarios/tabs.json",
    "scenario_sha256": "432f60edc0f4237f349f8eaa2c5216d63f4325e83dff3782412063e27142ba7d",
    "gpui_snapshot_path": "test/nucleus-a11y/snapshots/tabs.gpui.json",
    "gpui_snapshot_sha256": "5df0ccfbc252a66e611e32aec940b4d48c412ef679d2209cce7d86e27e872913",
    "svelte_snapshot_path": "test/nucleus-a11y/snapshots/tabs.svelte.json",
    "svelte_snapshot_sha256": "19806590f047a7864c4fc7a6af250561ef00c74c8254d16513d58424b257d2b8",
    "web_only_exclusions": [],
    "diff": []
  }
}